URL,Version,Status,OIDs,Name,Title,Description,Used
http://hl7.org/fhir/us/pco/CodeSystem/pco-care-tradeoff-choice-codes,0.2.0,active,,CareTradeOffChoiceCodes,Care Trade-off Choices,"Code system to identify care trade-off choices.",
http://hl7.org/fhir/us/pco/CodeSystem/pco-codes,0.2.0,active,,PCOCodes,Codes for PCO,"Codes to identify content associated with this IG",
http://hl7.org/fhir/us/pco/CodeSystem/pco-goal-domains,0.2.0,active,,PCOGoalDomains,PCO Goal Domains,"Goal domain codes used to identify the category for PCO resources.",
http://hl7.org/fhir/us/pco/CodeSystem/va-whole-health-example,0.2.0,active,,VAWholeHealthExample,VA Whole Health Concepts,"Code system to identify ""What Matters"" concepts from the VA Whole Health approach and Circle of Health.",
http://hl7.org/fhir/us/pco/CodeSystem/wellbeing-concepts,0.2.0,active,,WellBeingConcepts,Well-Being Concepts,"Code system to identify resource codes and category domains for ""What Matters"".",
